conditions,details,enrollment,id,last_monitored_change,last_updated,monitor_status,name,phases,primary_outcome,sponsor,status,study_end,study_start,target
"Pediatric Solid Tumor, Osteosarcoma, Rhabdomyosarcoma, Neuroblastoma, Ewing Sarcoma, Wilms Tumor, Adrenocortical Cancer, Desmoplastic Small Round Cell Tumor, Germ Cell Cancer, Rhabdoid Tumor, Clear Cell Sarcoma, Hepatoblastoma, Melanoma, Carcinoma, Malignant Peripheral Nerve Sheath Tumors, Soft Tissue Sarcoma","Treatment will include a single infusion of B7-H3-CAR T cells after lymphodepleting chemotherapy, with dosing based on the number of CAR+ T cells and patient weight. The study will evaluate the safety and maximum tolerated dose (MTD) of B7-H3-CAR T cells, using a standard 3+3 study design and a 6-week evaluation period. The total study duration will be 1 year, at which point patients will enroll on our existing institutional long-term follow-up protocol.",32,NCT04897321,2026-02-05,2025-10-23,No Change,B7-H3-Specific Chimeric Antigen Receptor Autologous T-Cell Therapy for Pediatric Patients With Solid Tumors (3CAR),PHASE1,Safety of B7-H3-CAR T cells,St. Jude Children's Research Hospital,RECRUITING,2027-03-01,2022-07-06,B7-H3
"Osteosarcoma, Resection Margins, B7-H3 Probe, Local Recurrence","Complete removal of all tumor tissue with a wide surgical margin is essential for the treatment of osteosarcoma (OS). However, it's difficult, sometimes impossible, to achieve due to the invisible small satellite lesions and blurry tumor boundaries. Besides, intraoperative frozen-section analysis of resection margins of OS is often restricted by the hard tissues around OS, which makes it impossible to know whether a negative margin is achieved. Herein, based on the high expression of B7-H3 in OS, a targeted probe B7H3-IRDye800CW is synthesized by conjugating anti-B7H3 antibody and IRDye800CW. This trial is aimed to investigate R0-resection rate and 2-y local recurrence rate after using this probe in Musculoskeletal tumor surgery for osteosarcoma as well as the safety parameters of this probe in human.",32,NCT06778603,2026-02-05,2025-01-11,No Change,B7-H3 NIR Imaging for Osteosarcoma Surgery,"PHASE1, PHASE2",Safety,Peking University People's Hospital,RECRUITING,2026-12-31,2024-01-01,B7-H3
"Pancreas Cancer, Relapse, Resistant Cancer","This is a phase 1, single-center, open-label study to determine the safety of escalating doses of chimeric antigen receptor T cells (CAR-T) cells targeting the B7-H3 antigen and containing the inducible caspase 9 safety switch (iC9-CAR.B7-H3 T cells) administered to adult subjects with refractory pancreatic ductal adenocarcinoma. The safety of iC9-CAR.B7-H3 T cells will be investigated using a modified 3+3 design with a starting dose of 1 × 106 transduced cells/kg. The data from the dose escalation will be used to determine a recommended phase 2 dose, which will be decided based on the maximum tolerated dose and additional factors such as the ability to manufacture sufficient cells for infusion.

The body has different ways of fighting cancer and other diseases; however, no single way seems perfect. The experimental treatment in this study combines two different ways the body fights cancer, and they are antibodies and T cells. Antibodies are proteins that protect the body from foreign invaders like bacteria. Antibodies work by attaching to these bacteria or substances, which stops them from growing and causing bad effects. T cells are special infection-fighting blood cells that can kill viruses and other cells, including tumor cells. Antibodies and T cells have been used to treat patients with cancer. They both have shown promise, but neither alone has been able to cure most patients. The treatment that is being studied in this study is called autologous T lymphocyte chimeric antigen receptor cells targeted against the B7-H3 antigen and containing inducible caspase 9 safety switch (iC9). The short name for this treatment is iC9.CAR.B7-H3 T cells. For the rest of this consent, we will refer to the iC9.CAR.B7-H3 T cells as the modified CAR-T cells for ease of reading this consent.",27,NCT06158139,2026-02-05,2025-03-14,No Change,Autologous CAR-T Cells Targeting B7-H3 in PDAC,PHASE1,Number of participants with adverse event,UNC Lineberger Comprehensive Cancer Center,RECRUITING,2028-06,2024-07-18,B7-H3
"Recurrent Glioblastoma, Refractory Glioblastoma","Background

* B7-H3 is expressed in 70% of patients with glioblastoma
* B7-H3 is not expressed in normal tissues especially not in central nervous system. Therefore, it is an attractive GBM target for CAR-T therapy
* The investigators constructed a retroviral vector encoding a chimeric antigen receptor (CAR) targeting B7-H3, which can mediate CAR transfer into patient T cells with high efficiency.

Objectives

* To evaluate the safety and tolerability intratumoral/intracerebroventricular injection of B7-H3 CAR-T when used in between Temozolomide cycles
* To compare the overall survival (OS) and progression-free survival (PFS) of R/R GBM patients treated with B7-H3 CAR-T in between Temozolomide cycles vs Temozolomide alone
* To access the pharmacokinetics and pharmacodynamics of B7-H3 CAR-T in between Temozolomide cycles

Design

* Experimental group: Patients autologous T cells are activated and transduced with retrovirus containing B7-H3 CAR. CAR-T cells are expanded ex vivo and infused back to patients via intratumoral or intracerebroventricular injection through an Ommaya catheter. 3 injections of CAR-T are planned at two different doses with 1-2 weeks intervals. The CAR-T injections occur in between Temozolomide (TMZ) cycles. Temozolomide treatment during the cycles of CAR-T injections will be stopped and resumed next cycle. Patients may receive additional CAR-T cycles at the discretion of the principal investigator and oncologist.
* Control group: Patients will receive regular cycles of Temozolomide treatment with 5 days of treatment and 23 days of interval.",40,NCT04077866,2026-02-05,2022-12-25,No Change,B7-H3 CAR-T for Recurrent or Refractory Glioblastoma,"PHASE1, PHASE2",Overall survival (OS),"Second Affiliated Hospital, School of Medicine, Zhejiang University",UNKNOWN,2025-08-01,2023-06-01,B7-H3
Advanced Solid Tumor,"This is a single-center, single-arm, open-label study. This study is planned to enroll about 30 subjects with advanced solid tumors. Autologous CAR-T cells were then infused intravenously into subjects, in a dose-escalating 3+3 design.",30,NCT05515185,2026-02-05,2022-08-23,No Change,B7-H3 Targeting CAR-T Cells Therapy for B7-H3 Positive Solid Tumors,EARLY_PHASE1,Dose-limiting toxicity,The First People's Hospital of Lianyungang,UNKNOWN,2024-09-08,2022-09-09,B7-H3
"Biomarker, Progression, Osteosarcoma, Surveillance","Increasing data has indicated an association between increased soluble B7-H3 (sB7-H3) levels and unfavorable prognosis in patients with malignancies. However, the level of sB7-H3 and its clinical significance in osteosarcoma are not well known. In this present study, we investigated whether sB7-H3 levels in serum could be as a biomarker for osteosarcoma treatment.",200,NCT05942456,2026-02-05,2024-05-11,No Change,Soluble B7-H3 as a Biomarker for Osteosarcoma,N/A,correlation of quantity of Protein B7-H3 Expression with clinical evaluation,Peking University People's Hospital,RECRUITING,2024-12-31,2023-06-05,B7-H3
Brain and Nervous System,"This is an open label, non-randomized, single site Phase I study to test the manufacturing feasibility and safety of locoregional (LR) administration of B7-H3CART into the central nervous system of adult subjects with recurrent IDH wild-type GBM using a standard 3+3 dose escalation design.",39,NCT05474378,2026-02-05,2025-10-10,No Change,B7-H3 Chimeric Antigen Receptor T Cells (B7-H3CART) in Recurrent Glioblastoma Multiforme,PHASE1,Number of successful manufacturing product (B7-H3CART) that met minimum assigned dose level range,Stanford University,RECRUITING,2026-08,2022-07-12,B7-H3
"Neuroblastoma, Sarcoma, Osteosarcoma",The purpose of this study is to test the manufacturing feasibility and safety of intravenous (IV) administration of B7-H3CART in children and young adult subjects with relapsed and/or refractory solid tumors expressing B7-H3 target using a standard 3+3 dose escalation design.,41,NCT06500819,2026-02-05,2025-04-18,No Change,Autologous B7-H3 Chimeric Antigen Receptor T Cells in Relapsed/Refractory Solid Tumors,PHASE1,Feasibility of manufacturing autologous T cells,"Crystal Mackall, MD",RECRUITING,2029-07,2024-07-11,B7-H3
"Recurrent Glioblastoma, Refractory Glioblastoma","Background

* B7-H3 is expressed in 70% of patients with glioblastoma
* B7-H3 is not expressed in normal tissues especially not in central nervous system. Therefore, it is an attractive GBM target for CAR-T therapy
* The investigators constructed a retroviral vector encoding a chimeric antigen receptor (CAR) targeting B7-H3, which can mediate CAR transfer into patient T cells with high efficiency.

Objectives

* To evaluate the safety and tolerability intratumoral/intracerebroventricular injection of B7-H3 CAR-T when used in between Temozolomide cycles
* To compare the overall survival (OS) and progression-free survival (PFS) of R/R GBM patients treated with B7-H3 CAR-T in between Temozolomide cycles to the historical Temozolomide data
* To access the pharmacokinetics and pharmacodynamics of B7-H3 CAR-T in between Temozolomide cycles

Design

Patients autologous T cells are activated and transduced with retrovirus containing B7-H3 CAR. CAR-T cells are expanded ex vivo and infused back to patients via intratumoral or intracerebroventricular injection through an Ommaya catheter. 3 injections of CAR-T are planned at two different doses with 1-2 weeks intervals. The CAR-T injections occur in between Temozolomide (TMZ) cycles. Temozolomide treatment in the cycle of CAR-T injections will be stopped and resumed next cycle. Patients may receive additional CAR-T cycles at the discretion of the principal investigator and oncologist.",12,NCT04385173,2026-02-05,2022-12-25,No Change,Pilot Study of B7-H3 CAR-T in Treating Patients With Recurrent and Refractory Glioblastoma,PHASE1,Incidence and type of adverse events,"Second Affiliated Hospital, School of Medicine, Zhejiang University",UNKNOWN,2024-05-01,2022-12-01,B7-H3
"Pediatric Solid Tumor, Neuroblastoma","This is a Phase I, open-label, single-center, dose-escalation study testing the safety and effectiveness of a new cell therapy B7-H3.CD28Z.CART / B7-H3 CAR T cells in children and young adult subjects with relapsed and/or refractory solid tumors expressing B7-H3.

The B7-H3 protein is found in high levels on many pediatric solid tumors (like neuroblastoma, osteosarcoma, and others), this cell therapy uses genetically altered blood cells as an investigational cell product designed to recognize, bind to and help kill cells that express B7-H3.

This is the first time that these specific B7-H3 CAR T cells will be given to humans. There are several other studies using a similar genetically modified version of B7-H3 CAR T cells and other studies have shown that B7-H3 is a safe target.

The U.S. Food and Drug Administration (FDA) has not approved B7-H3 CAR T cells as a treatment for any disease.

The research study procedures include screening for eligibility, in-clinic visits, blood tests, urine tests, electrocardiograms (ECGs), echocardiograms (ECHOs), bone marrow biopsies and aspirations.

It is expected up to 40 people will take part in this research study.

Band of Parents a non-profit organization is supporting this research study by providing funding.",40,NCT07358260,2026-02-05,2026-01-14,No Change,B7-H3.CD28Z.CART in Solid Tumors,PHASE1,Manufacturing Success Rate of Autologous B7-H3.CD28Z CART Cells,Robbie Majzner,NOT_YET_RECRUITING,2031-12-31,2026-06,B7-H3
"Central Nervous System Neoplasms, Atypical Teratoid/Rhabdoid Tumor, Diffuse Midline Glioma, H3 K27M-Mutant, Ependymoma, High Grade Glioma, Glioblastoma, Medulloblastoma",Treatment on this study includes four (4) B7-H3-CAR T cell infusions over a 4 week period. B7-H3-CAR T cells will be locoregionally administered via a CNS reservoir catheter without lymphodepleting chemotherapy. The study will evaluate the safety and maximum tolerated dose (MTD) of B7-H3-CAR T cells using a 3+3 study design and a 4 week evaluation period. Follow up will occur on this protocol for 1 year after the final B7-H3-CAR T cell infusion and then continue on an institutional long-term follow up protocol to complete 15 years post-infusion.,48,NCT05835687,2026-02-05,2026-01-15,No Change,Loc3CAR: Locoregional Delivery of B7-H3-CAR T Cells for Pediatric Patients With Primary CNS Tumors,PHASE1,Maximum tolerated dose (MTD),St. Jude Children's Research Hospital,RECRUITING,2028-03,2023-04-27,B7-H3
"Mesothelioma, Bladder Cancer, Melanoma, Squamous Cell Carcinoma of the Head and Neck, Non Small Cell Lung Cancer, Clear Cell Renal Cell Carcinoma, Ovarian Cancer, Thyroid Cancer, Breast Cancer, Pancreatic Cancer, Prostate Cancer, Colon Cancer, Soft Tissue Sarcoma","This study is a Phase 1 open-label, dose escalation, cohort expansion, and efficacy follow-up study of MGD009 administered intravenously (IV) on an every-other-week schedule for up to one year (14 cycles).

The dose escalation phase is designed to characterize the safety and tolerability of MGD009 and to define the maximum tolerated or maximum administered dose (MTD/MAD). This phase will enroll patients with mesothelioma, bladder cancer, melanoma, squamous cell carcinoma of the head and neck (SCCHN), non-small cell lung cancer (NSCLC), clear cell renal cell carcinoma (ccRCC), ovarian cancer, thyroid cancer, triple-negative breast cancer (TNBC), pancreatic cancer, colon cancer, soft tissue sarcoma, or prostate cancer.

In the cohort expansion phase, 6 cohorts of 16 patients each will be enrolled to further evaluate the safety and potential efficacy of MGD009 administered at the MTD/MAD dose in patients with mesothelioma, bladder cancer, melanoma, SCCHN, NSCLC, or other specific tumors that express high levels of B7-H3. Pre- and on-study biopsies are required for melanoma patients in the cohort expansion phase. Two additional cohorts (up to15 patients each) will evaluate the use of prophylaxis therapies to mitigate toxicity.

The survival follow-up phase consists of the 2-year period after the final dose of study drug.

All tumor evaluations will be carried out by both Response Evaluation Criteria in Solid Tumors (RECIST) and immune-related response criteria (irRC).",67,NCT02628535,2026-02-05,2022-02-04,No Change,Safety Study of MGD009 in B7-H3-expressing Tumors,PHASE1,Number of participants with adverse events,MacroGenics,TERMINATED,2019-11-25,2015-09,B7-H3
"Sarcoma, Childhood Osteosarcoma, Childhood Rhabdomyosarcoma, Childhood Soft Tissue Sarcoma, Ewing Sarcoma","This study is a phase I study designed to describe the safety of B7-H3-CAR T cells and lymphodepletion in combination with hypofractionated radiation therapy for the treatment of pediatric patients with B7-H3+ sarcoma.

The study will contain two-part eligibility criterion: one to proceed with autologous apheresis and manufacturing of CAR T cells, and a second to proceed with CAR T cell treatment.

The primary intervention is the administration of autologous B7-H3-CAR T cells, after priming with HFRT and administration of lymphodepleting chemotherapy. Peripheral blood mononuclear cells (PBMC) will be collected by autologous apheresis. Treatment will include HFRT to at least one site of disease, administered in parallel with a single course of lymphodepleting chemotherapy (fludarabine/cyclophosphamide) and followed by CAR T cell infusion. Participants are evaluated for a post-treatment tumor biopsy and may choose to be evaluated for a pre-treatment tumor biopsy. Participants who meet specified criteria will be eligible for optional additional treatment courses.",42,NCT07222735,2026-02-10,2026-02-06,Changed,Hypofractionated Radiation in Combination With B7-H3-CAR T Cells for Pediatric Patients With Relapsed/Refractory Sarcomas,PHASE1,Dose limiting toxicity (DLT) rate,St. Jude Children's Research Hospital,RECRUITING,2031-11-05,2026-01-21,B7-H3
"Brain Gliomas, High-Grade Gliomas, GBM","B7-H3 is expressed at low levels in normal tissues but overexpressed in various tumor tissues. The ubiquitous expression of B7-H3 in tumors of different grades is a key feature for brain gliomas. The immunohistochemistry study showed that B7-H3 is abundantly expressed on both glioma (especially high-grade glioma) cells and tumor-associated endothelial cells. For GBM, the expression of B7-H3 is intensely positive, especially on tumor cells and vascular endothelial cells, which makes B7-H3 a potential immunotherapeutic target.

γδ T cells recognize tumor cells without being restricted by MHC molecules, and thus can be used in allogeneic therapy without the risk of causing graft-versus-host disease.

This study is an open-label, single-arm, dose-escalation and dose-expansion clinical study aimed at evaluating the safety and efficacy of allogeneic B7-H3 CAR γδT in patients with malignant glioma.",25,NCT06018363,2026-02-05,2025-08-13,No Change,Clinical Study on the Treatment of Malignant Brain Glioma by QH104 Cell Injection,"PHASE1, PHASE2",Phase 1: Incidence of Adverse Events (AEs),Dushu Lake Hospital Affiliated to Soochow University,RECRUITING,2027-12-31,2023-06-01,B7-H3
Ovarian Cancer,"This is a single site, open label, Phase 1 study using a 3 + 3 dose escalation design in two cohorts of adults with recurrent, platinum-resistant ovarian tumors.",48,NCT06646627,2026-02-10,2026-02-05,Changed,Clinical Trial of Autologous B7-H3 CAR T Cells in Reoccurent Platinum-resistant Ovarian Tumors,PHASE1,Feasibility of B7-H3CART Manufacturing,Stanford University,RECRUITING,2026-07,2024-11-11,B7-H3
"Breast Cancer, Relapse, Resistant Cancer, Triple Negative Breast Cancer","T lymphocyte chimeric antigen receptor cells against the B7-H3 antigen (iC9-CAR.B7-H3 T cells) treatment is experimental and has not been approved by the Food and Drug Administration. The safety of iC9-CAR.B7-H3 T cells will be investigated using a modified 3+3 design. The data from the dose escalation will be used to determine a recommended phase 2 dose (RP2D), which will be decided based on the maximum tolerated dose (MTD) and additional factors such as the ability to manufacture sufficient cells for infusion.

Subjects with TNBC who meet procurement eligibility criteria will have cells collected to manufacture iC9-CAR.B7-H3 T cells. Eligible subjects will receive lymphodepletion with cyclophosphamide and fludarabine.",42,NCT06347068,2026-02-05,2025-09-15,No Change,Study of Autologous CAR-T Cells Targeting B7-H3 in TNBC iC9-CAR.B7-H3 T Cells,PHASE1,Toxicity: NCI-CTCAE,UNC Lineberger Comprehensive Cancer Center,RECRUITING,2028-05,2024-06-27,B7-H3
Solid Tumor,"Background: Patients with refractory and/or recurrent solid tumors have poor prognosis despite complex multimodal therapy; therefore, novel curative approaches are needed. The investigators are attempting to use T cells obtained directly from the patient, which can be genetically modified to express a 4th generation CD276-specific chimeric antigen receptor (4SCAR-276). The CAR molecules enable the T cells to recognize and kill tumor cells through the recognition of the surface CD276, which is expressed at high levels on tumor cells including brain tumors, Ewing's sarcoma (PNET) and many other tumors but not at significant levels on normal tissues. This study will evaluate the side effects and the best dose of a novel 4th generation anti-CD276 CAR T cells to target refractory and/or recurrent solid tumors.

Design:

1. Participants will be screened through physical exam and medical history. Blood and tumor tissue samples will be collected. Imaging studies will be performed.
2. Peripheral blood mononuclear cells (PBMC) will be obtained by apheresis, and T cells will be activated and modified to express the 4SCAR-276 gene.
3. On Day -5 to -7, PBMC will be activated and enriched for T cells, which will be followed by 4SCAR-276 lentiviral transduction. The total culture time is approximately 5-7 days.
4. Participants will receive a preparative conditioning regimen comprising cyclophosphamide/fludarabine to prepare their immune system to accept the modified CAR T cells. The preparative regimen will be based on patient immune condition and consistent with standard chemotherapy conditioning regimen.
5. The patients will receive \~10\^6 CART cells/kg body weight per infusion, and may receive additional booster CART infusions if positive outcome is recorded.",100,NCT04432649,2026-02-05,2020-06-11,No Change,Targeting CD276 (B7-H3) Positive Solid Tumors by 4SCAR-276,"PHASE1, PHASE2",Number of patients with adverse events,Shenzhen Geno-Immune Medical Institute,UNKNOWN,2024-05-31,2020-06-01,B7-H3
B7-H3-positive Relapsed/ Refractory Neuroblastoma,"In the dose-escalation phase of the Phase I clinical trial, a traditional 3+3 trial design was adopted, with a total of 3 dose groups designed. The dose of T/kg was gradually increased, and a total of 12-18 subjects with relapsed/refractory neuroblastoma were enrolled.Within each dose group, the next subject can be dosed after the previous subject has completed at least 14 days of safety observations. After the last subject of each dose group completed the dose-limited toxicity (DLT) evaluation within 28 days after a single dose, the SMC (Safety Monitoring Committee) agreed to enter the next dose group after evaluating the clinical safety data. After that, the enrolment treatment for the next dose group can be started.When 1 DLT occurs in 3 subjects in a dose group, 3 additional subjects in the same dose group (up to 6 subjects in this dose group complete the DLT assessment): If the additional 3 subjects If no DLT occurs, continue dose escalation; if 1 out of 3 additional subjects develops DLT, stop dose escalation; if \&gt; 1 of 3 additional subjects develops DLT DLT, then stop the dose escalation, and at the same time need to reduce a dose to continue to enroll 3 subjects for DLT evaluation.

In the dose expansion phase of the Phase I clinical trial, SMC will review the obtained safety and available data on efficacy, PK, immunogenicity, etc., and give the RP2D dose after comprehensive evaluation. In the dose expansion phase, the RP2D dose group will continue to be enrolled 3 \~6 subjects, further clarify the preliminary efficacy and safety of RP2D.",24,NCT05562024,2026-02-05,2023-02-23,No Change,TAA06 Injection in the Treatment of Patients With B7-H3-positive Relapsed/ Refractory Neuroblastoma,PHASE1,MTD,"PersonGen BioTherapeutics (Suzhou) Co., Ltd.",RECRUITING,2039-02-18,2022-12-30,B7-H3
Glioblastoma,"This is an open, single-arm, dose-escalation and multiple-dose study to evaluate the safety, tolerability and preliminary effectiveness of B7-H3-targeting Chimeric Antigen Receptor-T (CAR-T) cell therapy on patients with recurrent glioblastomas. The study also plan to explore the Maximum Tolerated Dose (MTD) and determine the Recommended Phase II Dose (RP2D) of the CAR-T cell therapy.",30,NCT05241392,2026-02-05,2025-02-09,No Change,Safety and Efficacy Study of Anti-B7-H3 CAR-T Cell Therapy for Recurrent Glioblastoma,PHASE1,Incidence of Dose Limiting Toxicity (DLT),Beijing Tiantan Hospital,ACTIVE_NOT_RECRUITING,2026-12-31,2022-01-27,B7-H3
Advanced Solid Tumors,"This study is a Phase 1, open-label, dose escalation, and cohort expansion study designed to characterize the safety, tolerability, PK, pharmacodynamics, immunogenicity, and preliminary antitumor activity of the combination of obrindatamab and retifanlimab, each of which is administered by IV infusion. The study consists of a Dose Escalation Phase to determine the Maximum Tolerated Dose (MTD) or Maximum Administered Dose (MAD) (if no MTD is defined) of the combination, followed by a Cohort Expansion Phase to further define the safety and initial antitumor activity of the combination with the doses established in the Dose Escalation Phase. Patients with B7-H3-expressing unresectable, locally advanced, or metastatic solid tumors of any histology will be enrolled in the Dose Escalation Phase. Following the establishment of an MTD, additional patients with specific tumor types will enroll in the Cohort Expansion Phase.",25,NCT03406949,2026-02-05,2022-05-18,No Change,MGD009/MGA012 Combination in Relapsed/Refractory Cancer,PHASE1,Incidence of Treatment-Emergent Adverse Events as assessed by CTCAE v4.03,MacroGenics,COMPLETED,2022-04-27,2018-02-27,B7-H3
