conditions,details,enrollment,id,last_monitored_change,last_updated,monitor_status,name,phases,primary_outcome,sponsor,status,study_end,study_start,target
"Neuroblastoma, Rhabdomyosarcoma, Osteosarcoma, Ewing Sarcoma, Wilms Tumor, Desmoplastic Small Round Cell Tumor","This study is a Phase 1, open-label, dose escalation and cohort expansion trial designed to characterize the safety, tolerability, PK, PD, immunogenicity and preliminary antitumor activity of enoblituzumab administered IV on a weekly schedule for up to 96 doses (approximately 2 years) in children and young adults with B7-H3-expressing relapsed or refractory malignant solid tumors.

The study consists of a Dose Escalation Phase to determine the MTD (or MAD) of enoblituzumab followed by a Cohort Expansion Phase to further define the safety and initial antitumor activity of enoblituzumab. In the cohort expansion phase, 5 cohorts of 10 patients each will be enrolled to further evaluate the safety and potential efficacy of enoblituzumab administered at the MTD/MAD in patients with:1) neuroblastoma - measurable disease, 2) neuroblastoma - non-measurable disease, 3) rhabdomyosarcoma, 4) osteosarcoma, and 5) Ewing's sarcoma, Wilms' tumor, desmoplastic small round cell tumors, or malignant solid tumors of any other histology that test positive for B7-H3.

All tumor evaluations will be carried out by both Response Evaluation Criteria in Solid Tumors (RECIST) and immune-related response criteria (irRC). Disease assessment in patients with neuroblastoma will use neuroblastoma overall response criteria.",25,NCT02982941,2026-02-05,2022-02-04,No Change,Enoblituzumab (MGA271) in Children With B7-H3-expressing Solid Tumors,PHASE1,Safety and tolerability of enoblituzumab.,MacroGenics,COMPLETED,2019-05-22,2016-12,B7-H3
Glioblastoma Multiforme,"This is a phase 1, single center, open-label study aims to determine the safety of escalating doses of chimeric antigen receptor T cells (CAR-T) cells targeting the B7-H3 antigen administered via intraventricular infusion to adult subjects with relapsed or refractory glioblastoma (GBM).

Subjects with GBM who meet procurement eligibility criteria will have cells collected following their initial surgical resection to manufacture CAR.B7-H3T cells, preferably prior to initiation of adjuvant chemoradiation.

At the time that the subjects have confirmed refractory or recurrent GBM, CAR.B7-H3T cells will be manufactured for subjects who likely to be eligible for cell infusion.

Eligible subjects will receive up to 3 weekly infusions of CAR.B7-H3 cells. To receive the additional cycles of CAR.B7-H3 cells, all treatment-related toxicities must have resolved to grade \< 3, the subject must not have experienced a dose limiting toxicity (DLT) and the subject must not have progressive disease that has been confirmed by magnetic resonance imaging per Immunotherapy response assessment in neuro-oncology criteria.

The data from the dose escalation will be used to determine a recommended phase 2 dose (RP2D), which will be decided on based on the maximum tolerated dose (MTD) and additional factors such as the feasibility of administering infusions.",36,NCT05366179,2026-02-05,2025-10-16,No Change,Autologous CAR-T Cells Targeting B7-H3 in Recurrent or Refractory GBM CAR.B7-H3Tc,PHASE1,Number of participants with adverse event,UNC Lineberger Comprehensive Cancer Center,RECRUITING,2030-05-30,2022-09-02,B7-H3
Epithelial Ovarian Cancer,"This study is intended for the patients who have been diagnosed with Epithelial Ovarian Cancer that either came back or did not improve after previous treatments. The purpose of this study is to test the safety of using a new treatment called autologous T lymphocyte chimeric antigen receptor cells against the B7-H3 antigen (CAR.B7-H3 T cells) in patients with ovarian cancer. This treatment has not been approved by the Food and Drug Administration.

The study investigator's goal is to calculate the Maximum tolerated dose of the CAR.B7-H3 cells There are two parts to this study. In part 1, subject's blood sample will be used to manufacture the CAR.B7-H3 T cells.

Ovarian cancer cells carry a substance called B7-H3 which is not found in other healthy cells. the subject's T cells will be modified to make CAR.B7-H3 T cells so they may attack and destroy ovarian cancer cells that carry the B7-H3 substance. The CAR.B7-H3 T cells are given through a catheter in the abdomen, after completing three rounds of lymphodepletion chemotherapy. Lymphodepletion chemotherapy prepares the body to receive the CAR.B7-H3 T cells.

In part 2 of the study, the subjects will receive the CAR.B7-H3 T cells. Eligible patients will receive lymphodepletion chemotherapy with cyclophosphamide and fludarabine for three consecutive days. If they continue to meet the eligibility criteria, the modified CAR.B7-H3 T cells will be given to them 2-14 days after the last lymphodepletion chemotherapy session. Three infusions of the CAR.B7-H3 T cells may be given to the subject through a catheter in the abdomen. Infusions will be done once a week.

Lymphodepletion chemotherapy and infusion of the CAR.B7-H3 T cells will happen at UNC Cancer Hospital. On the days the subjects receive the CAR.B7-H3 T cells infusion- Blood, fluid, and tumor samples will be collected from the subject for research purposes. Tumor biopsies are a mandatory part of this research.

Post infusion visits are - 3, 4, and 6 weeks. Additional visits will happen every 3 months for one year after the last infusion. Similar follow-up clinic visits will be completed annually, for a total of 5 years.

This is a research study to obtain new information that may help people in the future.",4,NCT04670068,2026-02-05,2025-12-04,No Change,Phase I Study of Autologous CAR T-Cells Targeting the B7-H3 Antigen in Recurrent Epithelial Ovarian,PHASE1,Number of Participants With Dose Limiting Toxicities (DLTs) Based on National Cancer Institute's Common Terminology Criteria for Adverse Events (CTCAE),UNC Lineberger Comprehensive Cancer Center,ACTIVE_NOT_RECRUITING,2030-02,2021-01-27,B7-H3
"Rhabdomyosarcoma, Ewing Sarcoma, Neuroblastoma, Wilms Tumor","This protocol is designed as a phase I dose-escalation study. Procurement phase: During the procurement phase of this protocol, upon SABRE Procurement Consent and procurement eligibility confirmation, participants will undergo a non-mobilized apheresis for collection of mononuclear cells to be used for the CAR-TA T cell product manufacturing.

Treatment phase: Once the CAR-TA T cell products are released and patients are confirmed eligible for CAR-TA T cell product infusion, participants will undergo protocol therapy at Children's National Hospital, consisting of a standard Lymphodepleting chemotherapy preparative regimen with fludarabine and cyclophosphamide, followed by intravenous infusion of the combined CAR-TA T cell product. The DNR-TA T cells and B7-H3 CAR T cells will be generated and combined into a final product comprised of the two T cell components combined at a 1:1 ratio. Patients will be enrolled to one of three CAR-TA T cell product dose levels (dose levels 1, 2 and 3). There are provisions in place to dose de-escalate for safety concerns (dose level -1).

Fludarabine will be administered intravenously once daily over 30 minutes, days -5 through -2 (4 doses in total). The dose of fludarabine will be 30 mg/m2 /day. Cyclophosphamide will be administered intravenously once daily over 30 minutes, days -5 and -4 (2 doses in total). The dose of cyclophosphamide will be 500 mg/m2 /day.

The first 3 patients enrolled on study will be ≥ 12 years of age at enrollment and treated at dose level 1 (1 x 10e6/kg). If no DLTs are observed in this cohort, enrollment at dose levels 2 (3 x 10e6/kg) and 3 (10 x 10e6/kg) will expand to include patients aged ≥ 1 year and \< 24 years.

Patients will remain admitted for at least 7 days following the CAR-TA T cell infusion. All infused patients will be followed with weekly visits during the 28-day dose-limiting toxicity monitoring period where they will be clinically assessed, and safety and research blood draws will be performed.

Ideally, patients should not receive other systemic or local cancer-directed therapies for at least 28 days after the CAR-TA T cell infusion.

Participants will be followed closely for 1 year following the CAR-TA T-cell infusion. After 1 year, yearly assessments will be done up to 15 years. The visits will consist of labs and examinations as well as talking to participants about how they are feeling. Participants will be followed for toxicity until the last follow-up post CAR-TA T cell product administration.

This study will be conducted at Children's National Hospital (CNH). Cell culture manipulations will be carried out in the CETI Good Manufacturing Practice (GMP) facility within Children's National Hospital using current standard operating procedures (SOPs).

Up to 18 participants will be treated on this protocol to meet the primary objective over an estimated accrual period of 5 years",18,NCT07172958,2026-02-05,2026-01-26,No Change,Selective Antigen Specific T Cells and CAR T Cells in Subjects With Relapsed/Refractory Embryonal Tumors (SABRE),PHASE1,Grade 3 or more immediate infusion-related adverse event,Children's National Research Institute,RECRUITING,2038-12,2026-01-27,B7-H3
"B7H3, CD276 Affibody, PET/CT Imaing","Based on \[68Ga\]B7H3 Affibody-BCH, this study investigates its radioactive uptake and imaging capabilities in tumor patients, with the aim of establishing a correlation between radioactive uptake and B7-H3 receptor expression. Utilizing whole-body PET technology, the pharmacokinetic dynamics of \[68Ga\]B7H3 Affibody-BCH are examined to ascertain its pharmacological characteristics. Ultimately, this research establishes a framework for pharmacokinetic analysis using whole-body PET.",50,NCT06454955,2026-02-05,2024-08-21,No Change,Study on B7-H3 Targeted Affibody Radioligand Probes for PET Imaging of Solid Tumors,EARLY_PHASE1,SUV,Peking University Cancer Hospital & Institute,RECRUITING,2026-11-30,2024-01-01,B7-H3
"Advanced Glioma, Complication of Chimeric Antigen Receptor (CAR-T) Cell Therapy","The goal of this clinical trial is to estimate the safety, tolerance and initial efficacy of target IL-13Rα2 or B7-H3 UCAR-T cell injection in the treatment of patients with advanced glioma, as well as the pharmacokinetic characteristics of its metabolites after single and multiple administrations and the biomarkers related to efficacy, safety and drug metabolism.",12,NCT05752877,2026-02-05,2023-03-02,No Change,Safety and Efficacy of Targeted IL-13 Rα2 or B7-H3 UCAR-T for Advanced Glioma,NA,Objective Response Rate,Second Affiliated Hospital of Soochow University,RECRUITING,2026-04-30,2021-05-01,B7-H3
"Malignant Melanoma, Lung Cancer, or Colorectal Cancer","B7-H3 (also known as CD276) is widely expressed on the surface of a variety of malignancies solid tumors, while it rarely or even doesn't express on normal tissues. Therefore, B7-H3 is an ideal target for chimeric antigen receptor (CAR) T cells therapy. TAA06 injection is a CAR T injection targeting B7-H3. This is a phase I clinical study with the primary objective of evaluating the safety and tolerability of TAA06 injection in subjects with TAA06-positive advanced solid tumors. The secondary objectives are as follows: to evaluate the distribution, proliferation and persistence of B7-H3-targeted CAR T cells after injection of TAA06 in subjects; to preliminarily evaluate the efficacy of TAA06 injection in subjects with TAA06-positive advanced solid tumor.",18,NCT05190185,2026-02-05,2021-12-29,No Change,A Clinical Trial of TAA06 Injection in Advanced Solid Tumors,PHASE1,Assessment of the safety after B7-H3 chimeric antigen receptor T cells infusion (Safety),"PersonGen BioTherapeutics (Suzhou) Co., Ltd.",UNKNOWN,2023-12-01,2021-06-01,B7-H3
"Lung Cancer, Cancer, Immunotherapy, CAR-T Cell","1. Choose appropriate patients with advanced lung or other cancers,with written consent for this study;
2. Perform biopsy to determine the expression of HER2, Mesothelin, Lewis-Y, PSCA, MUC1, GPC3, AXL, EGFR, Claudin18.2, or B7-H3 of the tumor by western blotting or IHC;
3. Collect blood from the patients and isolate mononuclear cells, activate the T cells and transfect the T cells with GPC3, Mesothelin, Claudin18.2, GUCY2C, B7-H3, PSCA, PSMA, MUC1, TGFβ, HER2, Lewis-Y, AXL, or EGFR targeting CAR, amplify the transfected T cells as needed, test the quality and killing activity of the CAR-T cells and then transfer them back the patients via systemic or local injections, and follow up closely to collect related results as needed;
4. To enhance the killing capability, CD4+ T cells are genetically engineered to express TGFβ-CAR and secret IL7/CCL19 and/or SCFVs against PD1/CTLA4/Tigit; CD8+T cells are constructed to express GPC3/Mesothelin/Claudin18.2/GUCY2C/B7-H3/PSCA/PSMA/MUC1/TGFβ/HER2/Lewis-Y/AXL/EGFR

   -DAP10-CAR with knockdown of PD1/HPK1;
5. Other cancers with these cell surface antigen expressions are also recruited if needed;
6. Evaluate the clinical results as needed.",30,NCT03198052,2026-02-05,2024-06-22,No Change,GPC3/Mesothelin/Claudin18.2/GUCY2C/B7-H3/PSCA/PSMA/MUC1/TGFβ/HER2/Lewis-Y/AXL/EGFR-CAR-T Cells Against Cancers,PHASE1,Number of Patients with Dose Limiting Toxicity,Second Affiliated Hospital of Guangzhou Medical University,RECRUITING,2036-08-01,2017-07-01,B7-H3
Advanced Extrapulmonary Neuroendocrine Cancer,"This study is an Open, Single-Arm, Single-Centre Efficacy and Safety Study of MHB088C for Injection in Patients with Advanced Extrapulmonary Neuroendocrine Cancer which cannot undergo surgical resection after failuer of standard treatment with platinum-contained or are unable to receive standard treatment with platinum-contained (including patients who are intolerant to standard treatment, deemed unsuitable for standard treatment by investigators, or refuse to receive standard treatment).

Participants will receive MHB088C intravenously at a dose of 2.0 mg/kg every 2 weeks (Q2W) until disease progression, with drawal from the study, or death.

During the study period, all participants will undergo tumor assessments every 2 treatment cycles (±7 days) in the first half-year after the first dose, and every 4 treatment cycles (±7 days) thereafter until disease progression, withdrawal from the study, or death. The schedule of tumor assessment related examinations is adjusted according to the administration time.After the end of treatment, all participants will receive a safety follow-up 30 days after the last dose,followed by survival follow-ups every 3 months until death, loss to follow-up, withdrawal of informed consent, or study termination by the institution.Biomarker analysis will be also performed on tumor samples collected from participants to explore their relationship with drug efficacy.

The primary endpoint is ORR (RECIST v1.1).The secondary endpoints include DCR、DoR、PFS、OS (RECIST v1.1) and the safety of MHB088C.",40,NCT06951243,2026-02-05,2025-04-22,No Change,A Trial of MHB088C in Advanced Extrapulmonary Neuroendocrine Cancer,PHASE2,Evaluate the Objective Response Rate (ORR) of MHB088C in Participants with Advanced Extrapulmonary Neuroendocrine Cancer after failuer of systematic treatment with platinum-contained (RECIST v1.1),Beijing GoBroad Hospital,NOT_YET_RECRUITING,2028-05-06,2025-05-06,B7-H3
"Castration-Resistant Prostate Cancer (CRPC), Colorectal Cancer, NSCLC (Non-small Cell Lung Cancer), Ovarian Cancer, Cervical Cancer, Endometrial Cancer, TNBC, Triple Negative Breast Cancer, Small Cell Lung Cancer (SCLC ), Head &Amp; Neck Squamous Cell Carcinoma (HNSCC), Esophageal Squamous Cell Carcinoma (ESCC)","The purpose of this study is to establish the safety profile, biodistribution, pharmacokinetics (pk), and radiation dosimetry of 177Lu-BetaBart, to determine the maximum tolerated dose (MTD) and/or recommended Phase 2 dose (RP2D), and to evaluate preliminary anti-tumor activity in select patient populations.

The study is divided into 2 phases. Phase 1 is the dose escalation phase to establish the safety profile of 177Lu-BetaBart and to determine the MTD and/or RP2D of 177Lu-BetaBart using a Bayesian Optimal Interval (BOIN) design. Phase 2a is the dose expansion phase at the RP2D to confirm the safety of the MTD and/or RP2D and to evaluate preliminary anti-tumor activity of 177Lu-BetaBart in select patient populations using a probability of success design for the objective response rate (ORR) based on a Bayesian beta-binomial design.

Participants ≥ 18 years of age with castration-resistant prostate cancer (CRPC), colorectal cancer (CRC), non-small-cell lung cancer (NSCLC), small-cell lung cancer (SCLC), head and neck squamous cell carcinoma (HNSCC), ovarian cancer, cervical cancer, endometrial cancer, triple negative breast cancer (TNBC), or esophageal squamous cell carcinoma (ESCC) who have documented disease progression during or after their most recent line of anticancer therapy will be eligible to enroll. CRC will be capped at 33% of enrollment per cohort.

Each phase consists of a Screening Period, a Treatment and Imaging Period, and a Safety and Long-term Follow-up Period.",61,NCT07189871,2026-02-05,2026-01-13,No Change,"177Lu-BetaBart in Patients With Relapsed/Refractory, Locally Advanced Inoperable, or Metastatic Solid Tumors","PHASE1, PHASE2",Recommended dose(s) of 177Lu-BetaBart for future exploration (phase 1),"Radiopharm Theranostics, Ltd",RECRUITING,2027-12,2026-02,B7-H3
"Ovary Neoplasm, Ovarian Cancer, Epithelial Ovarian Cancer, Recurrent","This phase 1, single-center, open-label study to determine the safety of escalating dosing of chimeric antigen receptor T (CAR-T) cells targeting the B7-H3 antigen and containing the inducible caspase 9 safety switch (iC9-CAR.B7-H3 T cells) administered to adult subjects with relapsed or refractory platinum-resistant epithelial ovarian cancer. The safety of iC9-CAR.B7-H3 T cells administered intraperitoneally via a port/catheter will be investigated using a modified 3+3 design with a starting dose of 1 ×106. The data from the dose escalation will be used to determine a recommended phase 2 dose (RP2D), which will be decided on based on the maximum tolerated dose (MTD) and additional factors such as the ability to manufacture sufficient cells for infusion. Additional subjects will be enrolled in an expansion cohort at the recommended phase 2 dose.

Subjects will receive standard-of-care therapy e.g., chemotherapy or radiation therapy to stabilize their disease if the treating physician feels it is in the subject's best interests before the cell therapy.

Subjects with ≥ grade 4 Cytokine Release Syndrome (CRS) or Immune Effector Cell-Associated Neurotoxicity Syndrome (ICANS) or grade 3 CRS or ICANS that do not improve to grade 0-1 within 72 hours will be given a 0.4mg/kg of rimiducid. Furthermore, subjects who experience a ≥ Grade 3 non-hematologic or hematologic toxicity (Excluding Grade 3 electrolyte abnormalities, hyperglycemia, diarrhea, or nausea and vomiting and Grade 3-4 hematologic toxicity without functional sequelae that do not persist at Grade 3-5 for \> 7 days) felt to be secondary to iC9-CAR.B7-H3 may be given rimiducid (0.4 mg/kg).",27,NCT06305299,2026-02-05,2025-09-12,No Change,Autologous CAR-T Cells Targeting B7H3 in Ovarian Cancer iC9-CAR.B7-H3 T Cells,PHASE1,Toxicity: NCI-CTCAE,UNC Lineberger Comprehensive Cancer Center,RECRUITING,2026-03,2024-07-29,B7-H3
Relapsed/Refractory Acute Myeloid Leukemia,"This study is a single arm, open label, dose increasing study to explore the characteristics of drug safety, tolerance and cell kinetics, and preliminarily observe the efficacy of the study drug in patients with relapsed/refractory B7-H3 positive acute myeloid leukemia, so as to explore the formal clinical appropriate dose.

After the subjects who signed the informed consent form were screened by the inclusion/exclusion criteria, the qualified subjects will enter 1.0 in order of priority × 108，3.0 × 108 and 6.0 × 108 CAR gdT groups were administered once. The ""3+3"" design was adopted in the dose increasing study, that is, 3-6 subjects in each group completed a single dose.

After the last subject in each dose group completed the dose limiting toxicity (DLT) assessment window 28 days after the single administration, the next dose group can be started after the Safety Monitoring Committee (SRC) agrees to enter the next dose group based on the evaluation of clinical safety data.

When 1 DLT occurs in 3 subjects in a certain dose group, 3 subjects need to be added in the same dose group (up to 6 subjects in this dose group complete DLT evaluation): if the added 3 subjects have no DLT, the dose will continue to increase; If one of the three additional subjects has DLT, stop the dose increase; If more than one of the three additional subjects has DLT, stop the dose increase, and at the same time, reduce one dose to continue the DLT evaluation of the three subjects.

The SRC can decide whether to increase or decrease the dose groups or adjust the dose of groups according to the pharmacokinetic results obtained during the study.",18,NCT05731219,2026-02-05,2023-02-15,No Change,UTAA06 Injection in the Treatment of Relapsed/Refractory Acute Myeloid Leukemia,PHASE1,Assessment of the safety after UTAA06 injection treatment (Safety),"PersonGen BioTherapeutics (Suzhou) Co., Ltd.",UNKNOWN,2025-09-26,2022-09-26,B7-H3
